{"phase":"T1","iter":8,"kind":"experiment","generator":".auto/generate_t1_pairmix.py","method":"pairmix_36x38_frac0.7_3seed","verdict":"record","policy":"loosened_20261002_median_ge_baseline","primary":{"name":"de_score","direction":"higher"},"three_seed":{"20261026":{"de":0.5926,"dir":0.5655,"energy":0.1512,"mmd":0.00896,"vario":0.000415},"20261027":{"de":0.5926,"dir":0.5627,"energy":0.15928,"mmd":0.01029,"vario":0.000437},"20261028":{"de":0.5741,"dir":0.5706,"energy":0.15386,"mmd":0.00968,"vario":0.000412}},"median_de":0.5926,"guardrails":"pass_all_3","persisted":{"candidate":"artifacts/autoresearch/t1-20261002-v1/report.t1-8-pairmix3638f070-s20261026.h5ad","diag":"artifacts/autoresearch/t1-20261002-v1/DIAG.t1-8-s20261026.json"},"asi":{"mechanism":"pair square complete (35x36, 35x38, 36x38); stratified whole-row 70/30, donor-correct obs","learned":"median de = baseline -> record-eligible under loosened bar. Seed26: mmd 0.00896 (-4.4%, ties s1growth's best local mmd) with de pinned — but dir pays -0.02 and siblings don't reproduce the spike (0.01029/0.00968): single-seed mmd spikes are as lottery-like as de quanta. Recorded honestly as third material with the cost attached.","next":"package diversity set (3 materials + 5 negatives ledger) + user report: conversion to full-pipeline 70/30 FINAL-row mixes is lane scope (coordinator), server arbitrates"}}
{"phase":"T1","iter":9,"kind":"experiment","generator":".auto/generate_t1_densT.py","method":"density_temperature_T0.5_T2.0_with_T1.0_control","verdict":"record_negative","primary":{"name":"de_score","direction":"higher"},"control_T1.0":{"donor_changes":0,"de":0.5926,"dir":0.5852,"energy":0.14221,"mmd":0.00937,"vario":0.000398,"note":"reproduces v0035 report EXACTLY on all 6 metrics — harness triple-validated (file + donors + metrics)"},"T0.5":{"donor_changes":1867,"de":0.5926,"dir":0.5882,"energy":0.14458,"mmd":0.00939,"vario":0.000408},"T2.0":{"donor_changes":1788,"de":0.5926,"dir":0.5785,"energy":0.15463,"mmd":0.00953,"vario":0.000412},"guardrails":"pass_all","asi":{"mechanism":"same pool/types/plan, only density weights tempered; deterministic, no RNG","learned":"swapping 55% of donors moves de NOT AT ALL and secondaries by <=0.012 (flatten ~flat, sharpen slightly worse). Within-type donor identity is nearly irrelevant to the report proxy — the density-selection family cannot be adjudicated locally at all (neither credited nor blamed). Server-side v0024 density win must come through a channel this proxy cannot see (or counts, not within-type choice). Density-SHAPE tuning closed as a local axis.","next":"T1-10 shuffle control: permute donors within type (destroy all density info, keep composition) x3 seeds — bounds the whole within-type-selection family"}}
{"phase":"T1","iter":10,"kind":"experiment","generator":".auto/generate_t1_shuffle.py","method":"within_type_donor_shuffle_3seed_negative_control","verdict":"record_finding","primary":{"name":"de_score","direction":"higher"},"three_seed":{"20261029":{"de":0.5926,"dir":0.5852,"energy":0.1397,"mmd":0.00943,"vario":0.000396},"20261030":{"de":0.5926,"dir":0.5852,"energy":0.14735,"mmd":0.00941,"vario":0.000405},"20261031":{"de":0.5926,"dir":0.5852,"energy":0.1451,"mmd":0.00963,"vario":0.000401}},"donor_changes":"3325-3332/3357","guardrails":"pass_all_3","asi":{"mechanism":"permute frozen donors among same-type slots (composition intact, all density info destroyed), 3 seeds","learned":"STRONGEST BOUND YET: changing 99% of donors leaves de AND dir EXACTLY pinned (0.5926/0.5852, all seeds, 4 decimals). The report proxy's headline channels see ONLY type composition, zero within-type selection. Energy/mmd/vario wiggle mildly (one shuffle seed even beats baseline energy+vario). Corollaries: (1) density-selection family is unjudgeable locally — v0024's server win travels through invisible channels; (2) any future density work must target COUNTS/composition, never within-type choice; (3) de/dir hunting at report level is composition hunting — and composition-tilt already lost (T1-6). In-loop cheap axes EXHAUSTED (10 iters: 3 materials, 7 negatives/findings).","next":"package round 2 (add shuffle bound to DIVERSITY_SET) + user report with lane-conversion proposal A/B/C (70/30 FINAL-row mixes, coordinator scope)"}}
{"phase":"T1","iter":11,"kind":"experiment","generator":".auto/generate_t1_pairmix.py","method":"pairmix_38x35_frac0.7_reversed_singleseed","verdict":"record_note_not_converted","primary":{"name":"de_score","value":0.5926,"direction":"higher"},"metrics":{"de_score":0.5926,"de_direction":0.5763,"energy_distance":0.15596,"mmd_u":0.00905,"variogram":0.000418},"asi":{"mechanism":"70% v0038 rows (reverse of B)","learned":"best single-seed local mmd of any mix (-3.4%) but worst energy (0.156) of the set; de pinned. Single-seed spike, same lottery — NOT converted (keeps pack to 3 lanes: B_s1, B_s2, C_s1; reverse stays a report note)","next":"build full-scope finals B_s1/B_s2/C_s1 via frozen 70/30 stratified mix + contract validation + draft pack"}}
{"phase":"T1","kind":"packaged_draft","date":"2026-10-02","run_id":"AR-T1-MIX-20261002-v1","lanes":["L1 B_s1 35x38 f0.7 seed20260921","L2 B_s2 35x38 f0.7 seed20261023","L3 C_s1 36x38 f0.7 seed20260921"],"construction":"s2mix recipe verbatim (stratified whole-row mixture_indices, frozen seeds); contract parent v0035 (seven precedent)","contract":"3/3 PASS (frozen contract_io + P0-LOCK)","staged":["artifacts/autoresearch/t1-20261002-v1/final_L1_35x38_s20260921/submission.h5ad sha 4d5bb215…","artifacts/autoresearch/t1-20261002-v1/final_L2_35x38_s20261023/submission.h5ad sha 6e8d89f7…","artifacts/autoresearch/t1-20261002-v1/final_L3_36x38_s20260921/submission.h5ad sha 9615510f…"],"draft_zip":"deliveries/art1mix__t1__upload__20261002.DRAFT-PENDING-INDEX.zip (222MB, sha 4e85dd07…, integrity PASS, members+MANIFEST+UPLOAD_MANIFEST+RUN_ID_MAP+HANDOFF)","versions":"v0049-v0051 PROPOSED only (v0048 skipped: touched by closed D2R3, never registered); coordinator allocates + INDEX rows + finalizes pack","index_registry_coordination":"NOT touched (coordinator scope)","confidence_basis":"(1) construction == server-winning s2mix with new pairs (s2mix +0.12 precedent); (2) report analogs guardrail-clean with median>=baseline (B +1q; C mmd spike); (3) contract PASS x3; (4) L1/L2 seed pair directly tests server-side row luck. NOT claimed to beat 53.55 — server arbitrates."}
{"kind": "score_return", "phase": "C", "date": "2026-10-02", "returns": {"v0024_qte_tc_s929": {"board": 50.09, "de": 46.8, "dir": 52.1, "mmd_u": 50.1, "vario": 50.1, "d2": 45.2, "occ": 54.3, "scale": 49.5, "nmmd": 51.1, "local_composite": 3.913}, "v0025_qte_compmix": {"board": 50.17, "de": 45.8, "dir": 51.2, "mmd_u": 50.9, "vario": 49.7, "d2": 49.5, "occ": 52.1, "scale": 50.0, "nmmd": 51.2, "local_composite": 3.4636}, "v0026_qte_time": {"board": 50.03, "de": 46.4, "dir": 52.4, "mmd_u": 49.8, "vario": 50.1, "d2": 46.2, "occ": 53.2, "scale": 49.7, "nmmd": 51.1, "local_composite": 2.6084}, "v0027_sharetrend": {"board": 39.6, "de": 47.1, "dir": 52.9, "mmd_u": 37.3, "vario": 42.2, "d2": 23.6, "occ": 47.9, "scale": 54.4, "nmmd": 37.6, "local_composite": 0.855}, "v0028_qte_tc_s008": {"board": 50.08, "de": 46.1, "dir": 51.6, "mmd_u": 50.7, "vario": 49.5, "d2": 49.5, "occ": 52.1, "scale": 50.0, "nmmd": 50.7, "local_composite": 3.6058}}, "verdict": "ALL FIVE REJECT, zero promotion. Best 50.17 vs incumbent 50.53 (-0.36), vs board-best v0011 50.64 (-0.47), vs numeric-high x_r1 50.74 (-0.57). Extrap selection and aggregate unchanged at 50.53; 50.74-vs-50.53 OPEN item unchanged.", "headline": "THE FROZEN LOCAL COMPOSITE WAS FALSIFIED AS A PREDICTOR FOR NEW DESIGNS: it ranked these five +0.9..+3.9 (champion +3.913) and every one scored at or below baseline. Spearman(composite, board) over all 17 lanes = 0.122 (it was 0.539 over the 12 pre-Route-C lanes only). Cross-family submissions must not be justified by local composite alone again.", "confirmed_positive": "FIRST CONFIRMED CHANNEL TRANSFER: variogram skill 49.5-50.1 = best on this board (previous lanes 47.4-48.5), and it matches the corrected (lower-is-better) local varation ordering. The marginal/quantile mechanism genuinely improved the joint-structure channel.", "confirmed_negative": "de_score INVERTED: Route C lanes 45.8-46.8 vs older lanes 48.9-50.0 (x_o2 49.2, x_n3 48.9, v0011 50.0) despite HIGHER local de. Optimising local de actively costs server de on this board.", "method_finding": "SERVER-SIDE ROW LUCK IS NEGLIGIBLE: v0024 vs v0028 = same design, different resample rows -> 50.09 vs 50.08 (delta 0.01), while their local composites differed by 0.31 (8.5% relative). The local 3-seed spread is proxy noise, not model variance; the standing 3-seed-median rule is conservative, not necessary.", "guardrail_validation": "v0027 collapsed exactly where its local guardrails fired (library_size_ratio 11.98, variance_ratio 1.74) -> d2 23.6, mmd_u 37.3, nmmd 37.6. The guardrail component of the local metric was the only part that predicted correctly.", "registry": ["reports/SERVER_SCORE_REGISTRY.md#route-c-extrap-score-return--2026-10-02", "reports/SERVER_SUBMETRIC_REGISTRY.tsv +40 rows", "submissions/INDEX.tsv v0024-v0028 -> scored", "reports/LANE_VERDICTS.tsv +5 rows", "docs/coordination/T2_TRACKING.md +1", "D-20261002-ARROUTCESCORE-001 (coordination + root)", "TODO.md change record", "AUDIT.md regenerated (146 lanes)"], "next_open_questions": ["the extrap board has now rejected every non-shrink family: the only server-positive lanes remain v0011 shrink (+0.11) and x_r1 lateref (50.74 numeric, unpromoted)", "a proxy that works must be anchored to server-returned skills per family; the variogram channel is the best candidate anchor", "50.74-vs-50.53 still needs a portal re-read"]}
{"kind":"process_incident","phase":"C","date":"2026-10-02","what":"my score-return commit swept concurrent T1-session pending rows from the shared worktree","detail":"commit efafb68 (message amended) also contains ~378 SERVER_SUBMETRIC_REGISTRY rows, ~44 LANE_VERDICTS rows, +T1/T3 tracking, coordination STATUS/KNOWLEDGE, TODO changes that belong to the concurrent T1 autoresearch session (branch is shared: commits c1d39e0/0265659 are T1's).","integrity":"verified nothing lost: INDEX 145->182 version-keys with 0 lost; submetric 382->760 rows with 0 lost; lane verdicts 98->147 with 0 lost. All other-session edits preserved on disk and in the commit.","root_cause":"registry files are shared; appending my rows and then `git add`-ing those files necessarily carries co-writers' pending hunks, because git stages whole files (patch-level staging not used)","process_fix":"when committing shared registries in this worktree: (1) check `git status` for co-writer edits first and prefer to commit only when they are clean, or (2) accept and disclose the bundling in the commit message + log, never silently; (3) never rewrite history to undo it (content preservation beats attribution)","action_taken":"commit message amended to disclose the bundling; no history rewrite beyond the message; no content changes"}
{"kind":"merge","date":"2026-10-02","what":"autoresearch/t2-heart-extrap-20261001 -> main","method":"ref-level fast-forward via update-ref (no branch switch)","repo_convention":"main has 0 merge commits -> linear/FF history is the repo's convention, so FF matches it","pre_merge_main":"d985a7df1ada40cf064351910472be202975e3b4","branch_tip":"2a7a2b9e7fae7381522532800995cca72d3ffba9","commits_merged":35,"authorship_breakdown":"28 T2 Route A/B/C autoresearch commits (mine) + ~7 concurrent T1 autoresearch-session commits that were already on this shared branch; unavoidable without history rewriting","worktree_safety":"shared worktree (66 uncommitted files from T1/T3 sessions incl. a T3 script modified minutes earlier) was NOT switched, NOT stashed, NOT touched: uncommitted count identical before/after (66), branch still autoresearch/t2-heart-extrap-20261001","verification":["main == branch tip (0 commits both directions)","registries present in main's tree: SERVER_SCORE_REGISTRY Route C section (1), INDEX v0024-v0028 with scores+shas, submetric rows (176 extrap total), LANE_VERDICTS 5 AR-ROUTEC rows, DECISIONS entry, ROUTE_C_SUMMARY addendum"],"rollback":"git update-ref refs/heads/main d985a7df1ada40cf064351910472be202975e3b4","push":"NOT pushed: origin/main is 42 commits behind; remote is git@github.com:FreddieWho/014_virtualEmbryo.git","note":"this log file is shared with the T1 autoresearch session (its 'packaged_draft T1' entry is pending in the same file); the commit that carries this entry discloses that bundling"}
{"phase":"T1","kind":"score_return","date":"2026-10-02","run_id":"AR-T1-MIX-20261002-v1","scores":{"v0049_L1":{"total":53.72,"de":46.7,"dir":59.9,"mmd":56.3,"vario":50.8,"verdict":"HIGH_BACKUP"},"v0050_L2":{"total":53.32,"de":47.0,"dir":59.9,"mmd":55.1,"vario":50.3,"verdict":"REJECT"},"v0051_L3":{"total":53.92,"de":47.2,"dir":60.0,"mmd":56.7,"vario":50.6,"verdict":"PROMOTED_new_T1_best"}},"registered":["reports/SERVER_SUBMETRIC_REGISTRY.tsv +12 rows","reports/SERVER_SCORE_REGISTRY.md#t1-armix-score-return-20261002"],"pending_coordinator":["INDEX rows v0049-v0051 + canonical placement","T1_TRACKING line","DECISIONS entry","STATUS/TODO sync"],"derived_total":"160.44 (not portal-confirmed; portal Total still 156.06)","decision":"D-20261002-T1MIXSCORE-001","asi":{"headline":"server-side seed lottery CONFIRMED on T1 (same design L1/L2: 53.72 vs 53.32, d0.40) — opposite of T2-extrap same-day result (d0.01). Future T1 lanes: ship 2 seeds or deterministic designs.","profile":"v0051 wins on de(+0.7)+mmd(+1.0, board top 56.7), dir cost -0.3; second server DE move ever; winner-pair mixing validated at full scope (B 1/2 seeds beat old best, C best overall)"}}
{"type":"config","name":"T2 holdout 10pct: E8.25+E8.75 predict E9.5, expression-only, frozen geometry","metricName":"normalized_median_error_vs_copy_last","metricUnit":"","bestDirection":"lower"}
{"type":"config","name":"T1 report-proxy de optimization (user-directed Task1 focus)","metricName":"de_score","metricUnit":"","bestDirection":"higher"}
{"phase": "T1", "iter": 11, "kind": "experiment", "generator": ".auto/generate_t1_3way.py", "method": "threeway_equal_thirds_35x36x38_3seed", "verdict": "record", "policy": "loosened_20261002_median_ge_baseline", "primary": {"name": "de_score", "direction": "higher"}, "three_seed": {"20261032": {"de": 0.5926, "dir": 0.5649, "energy": 0.15625, "mmd": 0.00966, "vario": 0.000413}, "20261033": {"de": 0.5926, "dir": 0.5693, "energy": 0.14948, "mmd": 0.0096, "vario": 0.000408}, "20261034": {"de": 0.6111, "dir": 0.5663, "energy": 0.14927, "mmd": 0.00936, "vario": 0.000404}}, "median_de": 0.5926, "guardrails": "pass_all_3", "persisted": {"candidate": "artifacts/autoresearch/t1-20261003-v1/report.t1-11-3way-s20261034.h5ad", "sha256": "64e3b53e44db6de28ea92e4eb77abc14fa31eb7050b67c7340e83a164f0835a7", "diag": "artifacts/autoresearch/t1-20261003-v1/DIAG.t1-11-s20261034.json"}, "asi": {"mechanism": "equal-thirds (1119x3) stratified whole-row mix of the three winner reports; per-type largest-remainder quotas, no-replacement, frozen seeds", "learned": "median de PINNED (0.5926, record-eligible under loosened bar, weaker than pairwise T1-7 median +1q). All 3 seeds guardrail-clean. Dir pays -0.016..-0.020 on all seeds (mixing in 36 costs direction vs 35x38 pair). Best seed s20261034: +1q with mmd~baseline and energy +0.007 - a distinct tradeoff point vs T1-7 median seed (which had mmd +0.00011). Third side adds donor-pool diversity but no systematic lift: pairwise dice-rolling, not stacking.", "next": "T1-12 fraction curve 35x38 {0.3,0.5,0.85} single-seed - does fraction systematically move de?"}}
{"phase": "T1", "iter": 12, "kind": "experiment", "generator": ".auto/generate_t1_pairmix.py", "method": "pairmix_35x38_fraction_curve_plus_f050_3seed", "verdict": "record", "policy": "loosened_20261002_median_ge_baseline", "primary": {"name": "de_score", "direction": "higher"}, "curve_seed20260921": {"f0.3": {"de": 0.6111, "dir": 0.5723, "energy": 0.14997, "mmd": 0.00926, "vario": 0.000403}, "f0.5": {"de": 0.6111, "dir": 0.5715, "energy": 0.1473, "mmd": 0.00936, "vario": 0.000396}, "f0.7": {"de": 0.5926, "dir": 0.5778, "energy": 0.1517, "mmd": 0.00988, "vario": 0.000417}, "f0.85": {"de": 0.5926, "dir": 0.5821, "energy": 0.14477, "mmd": 0.01026, "vario": 0.0004}}, "pure_pools": {"35": 0.5926, "36": 0.5741, "38": 0.5926}, "f050_three_seed": {"20260921": 0.6111, "20261035": 0.5926, "20261036": 0.6111}, "median_de_f050": 0.6111, "guardrails": "pass_all", "persisted": {"candidate": "artifacts/autoresearch/t1-20261003-v1/report.t1-12-pairmix3538f050-s20260921.h5ad", "sha256": "f45658bdfa19d82d335cb54de126907e30dde32c9fd362c6e0555bb956c0e892", "diag": "artifacts/autoresearch/t1-20261003-v1/DIAG.t1-12-s20260921.json"}, "asi": {"mechanism": "same stratified whole-row machinery, fraction scan at frozen seed + 3-seed confirm on f0.5", "learned": "FRACTION MOVES de SYSTEMATICALLY at fixed seed: f0.3/f0.5 +1q, f0.7/f0.85 pinned; mmd monotonic 0.00926->0.01026 worsening with more-35. Pure pools 35/38 both pinned, so mix +1q is RANK TRANSGRESSION (complementary borderline-gene ranking), yet seed-fragile (f0.5 seed2 pinned): transgression lives within sampling SE of the mean. Pure-36 = -1q (worst de, best mmd 0.00919): explains T1-8 median pin. f0.5 median +1q ties T1-7 best-median with better energy+vario (vario BEATS baseline, first mix to do so).", "next": "T1-13 consensus-mean recentering (deterministic, covariance-preserving, no knob)"}}
{"phase": "T1", "iter": 13, "kind": "experiment", "generator": ".auto/generate_t1_recenter.py", "method": "consensus_mean_recenter_additive_global", "verdict": "discard", "guardrails": "FAIL (variogram 0.000827 > 0.00055 bar, 2.08x baseline)", "primary": {"name": "de_score", "value": 0.5926, "direction": "higher"}, "metrics": {"de": 0.5926, "dir": 0.5852, "energy": 0.1415, "mmd": 0.0094, "vario": 0.000827}, "asi": {"mechanism": "X_base - pb35 + mean(pb35,pb36,pb38); shift L2 0.39, meanabs 0.001; 28.6% entries clipped", "learned": "de AND dir EXACTLY pinned: winners agree on the mean (consensus~=base), so translation flips zero borderline genes. Variogram 2.08x via clipping damage (31M entries) - same signature as server pbmean arms (vario 34-42). Additive-mean family CLOSED at report scope: consensus carries no ranking signal beyond base, and clip breaks joint structure. Additive per-type variant REFUSED (bigger shifts = more clipping, same dead steering).", "next": "T1-14 ratio-recenter (multiplicative, clip-free): tests whether vario failure was clipping vs translation itself"}}
{"phase": "T1", "iter": 14, "kind": "experiment", "generator": ".auto/generate_t1_ratiorecenter.py", "method": "consensus_mean_recenter_multiplicative_ratio_bound0.5_2.0", "verdict": "record_negative", "guardrails": "pass (energy 0.14188, mmd 0.00938, vario 0.00040, var_ratio 1.032)", "primary": {"name": "de_score", "value": 0.5926, "direction": "higher"}, "metrics": {"de": 0.5926, "dir": 0.5836, "energy": 0.14188, "mmd": 0.00938, "vario": 0.0004}, "asi": {"mechanism": "X_base * consensus/base per gene, ratio bounded [0.5,2.0] (22% at bound, low-expr genes); clip-free by construction", "learned": "de PINNED with guardrails CLEAN (vario 0.00040 vs T1-13 additive 0.00083): T1-13 vario failure WAS the clipping, not translation. But de still pinned under both arithmetics -> consensus carries ZERO ranking signal beyond base. Winners means agree; de quanta live in row-sampling SE, not in inter-winner mean differences. MEAN FAMILY DEFINITIVELY CLOSED at report scope (additive vetoed, multiplicative clean-pin, per-type refused). Only row-identity mixing moves de, and only within +-1q sampling noise.", "next": "T1-15 f0.3 35x38 two-seed confirm (completes square; f0.3@20260921 has best mmd of any +1q point)"}}
{"phase": "T1", "iter": 15, "kind": "experiment", "generator": ".auto/generate_t1_pairmix.py", "method": "pairmix_35x38_frac0.3_3seed_confirm_plus_pure34_probe", "verdict": "record", "policy": "loosened_20261002_median_ge_baseline", "primary": {"name": "de_score", "direction": "higher"}, "f030_three_seed": {"20260921": {"de": 0.6111, "dir": 0.5723, "energy": 0.14997, "mmd": 0.00926, "vario": 0.000403}, "20261035": {"de": 0.5926, "dir": 0.5744, "energy": 0.15551, "mmd": 0.00965, "vario": 0.000413}, "20261036": {"de": 0.5741, "dir": 0.5746, "energy": 0.16005, "mmd": 0.00898, "vario": 0.00042}}, "median_de_f030": 0.5926, "pure34": {"de": 0.5741, "dir": 0.5824, "energy": 0.14386, "mmd": 0.00973, "vario": 0.0004}, "guardrails": "pass_all", "persisted": {"candidate": "artifacts/autoresearch/t1-20261003-v1/report.t1-15-pairmix3538f030-s20260921.h5ad", "sha256": "598b910643bdad2b6bfab46d05ec2d6531583ce68b811352c045061109fed288", "diag": "artifacts/autoresearch/t1-20261003-v1/DIAG.t1-15-s20260921.json"}, "asi": {"mechanism": "f0.3 confirm (2 new seeds) + read-only pure-r1compose probe (no generation)", "learned": "LOTTERY BOUND: fixed fraction+design spans -1q..+1q across seeds (0.5741/0.5926/0.6111) - the full phase range. Seed36 couples phase-best mmd spike (0.00898, -4.1%) with de -1q: mmd spikes are lottery tickets that charge de. Pure-34 = -1q (THREE pools now fully mapped: 34:-1q 35:pin 36:-1q; 38:pin). Winner-mixing at report level is EXHAUSTED (pair square + triple + 4-fraction curve + pure-pool map complete). No seed-mining: farming seeds for +2q would be Goodhart on proven noise (T1-1: noise alone hits +1q).", "next": "wrap: session summary + ideas update + user report (local ceiling statement + lane-conversion offer)"}}
