{"phase": "C_reinit", "kind": "session_header", "date": "2026-10-01", "primary": {"name": "COMPOSITE", "definition": "mean of 8 winsorized relative gains (de, dir, mmd_u, vario, d2, occ, scale, nmmd) x 100; mirrors the portal skill vector; baseline=0.0 by construction", "config": ".auto/composite_config.json (frozen, directions source-verified)"}, "incumbent_champion": {"label": "x_o2_shrinkcomp (v0021, server 50.52)", "composite": 1.709}, "runner_up": {"label": "x_n3_compmix (v0019, server 50.38)", "composite": 0.931}, "keep_bar": {"deterministic": "composite > +1.709 (beat local champion) AND guardrails pass", "resampling": "3-seed median > +1.709 AND all seeds guardrail-clean", "record_only": "any composite > +1.0 is reported but must beat the champion to be kept"}, "guardrails": {"de_score_min": 0.22, "library_size_ratio_max": 2.0, "variance_ratio_range": [0.8, 1.6], "pb_rel_err_max": 0.65}, "proxy_validity": {"spearman_composite_vs_server": 0.5385, "n": 12, "reading": "moderate positive (0.54) \u2014 far better than the adversarial/inverted behaviour recorded for earlier proxies; extremes are ranked correctly (worst lane x_n1 lowest composite; top-2 server lanes include the top-2 composites). Mid-band is noisy: v0011 has the top server score but sits at +0.03.", "limits": "n=12, one board, already-scored lanes only; NOT a promotion license \u2014 local-only, server score still required for any claim"}, "geometry_caveat": {"fact": "d2/occ/scale channels are frozen for all expression-only algorithms (geometry untouched), so 3 of 8 channels contribute ~0", "warning": "scale_log_ratio vs the proxy target is a subset artifact (proxy target is a cardiac-only subset) -> tuning scale against the proxy would be leakage; only trend-extrapolated growth rules would be defensible, deferred"}, "algorithm_pool": ["quantile bridge (per-state per-gene rank/quantile mapping)", "CORAL covariance matching per state", "robust delta (trimmed mean/median)", "low-rank SVD delta projection", "per-gene LOOCV extrapolation-function selection (linear/log/quadratic)", "bootstrap-bagged delta", "ensembles of the above"], "hard_rules": ["no target_used", "no proxy-tuning knobs (each algorithm single-shot with data-frozen internal rule)", "resampling designs = 3 seeds median", "no leaderboard claims from local composite"]}
{"iter":12,"kind":"experiment","phase":"C","generator":".auto/generate_qte.py","method":"quantile_trend_extrapolation_QTE","verdict":"keep","new_local_champion":true,"persisted":"artifacts/autoresearch/t2-extrap-20261001-v1/submission.iter12-qte.h5ad","primary":{"name":"COMPOSITE","value":2.3768},"prev_champion":1.709,"metrics":{"de_score":0.2603,"de_direction":0.4234,"neighborhood_mmd":0.19816,"morans_I_agreement":0.7922,"variogram":0.070629,"mmd_u":0.09959,"energy_distance":3.50267,"pseudobulk_pearson":0.7921,"variance_ratio":1.402,"occupancy_dice":0.8207,"d2_shape":0.0153,"sliced_wasserstein":0.04086,"scale_log_ratio":0.2155,"count_log_ratio":0.7342,"library_size_ratio":1.0,"pb_rel_err":0.5511,"wall_s":13.0},"gains":{"de":0.0556,"dir":0.0031,"mmd_u":0.0486,"vario":0.0489,"d2":0.0,"occ":0.0,"scale":0.0,"nmmd":0.034},"guardrails":"pass","asi":{"mechanism":"per-state per-gene quantile-function extrapolation Qpred(p)=Q9(p)+(Q9(p)-Q8(p)) on a 2001-point probability grid; each baseline row mapped to Qpred at its own within-state rank probability. Generalises the mean shift to the whole marginal. Deterministic, no RNG, single canonical interval (no lambda scan).","learned":"BEATS CHAMPION +2.377 vs +1.709 AND improves EVERY expression channel simultaneously: de +5.6%, mmd_u -4.9%, variogram -4.9% (0.07063 = best local variogram ever measured on this board, better than x_o2's 0.0747), nmmd -3.4%; dir flat. Clip fraction 1.55% vs 17-24% for every mean-shift design -> the mechanism is real: mean shifts distort the marginal and dump mass through clipping, quantile extrapolation moves the whole distribution shape. geometry channels untouched by construction (0.0 exactly)","residue":[{"note":"variance_ratio 1.402 vs baseline 1.227, still inside guardrail [0.8,1.6] but drifting; monitor on variants","fact":"energy_distance 3.5027 slightly worse than baseline 3.4929"}],"caveat":"local-only; proxy validity rho=0.54 means this is a candidate for a later frozen lane + server read, NOT a claimed improvement","next":"try to beat +2.377 with structurally different algorithms: 3-stage quantile curvature, CORAL covariance matching, robust trimmed delta, low-rank SVD delta, per-gene LOOCV model selection, then ensembles"}}
{"iter":13,"kind":"experiment","phase":"C","generator":".auto/generate_coral.py","method":"coral_covariance_alignment_per_state","verdict":"discard","primary":{"name":"COMPOSITE","value":-4.6115},"metrics":{"de_score":0.2329,"de_direction":0.4123,"neighborhood_mmd":0.20448,"variogram":0.115497,"mmd_u":0.10398,"energy_distance":3.53473,"variance_ratio":1.213,"clip_fraction":0.4471},"gains":{"de":-0.0556,"dir":-0.0232,"mmd_u":0.0067,"vario":-0.30,"nmmd":0.0032},"guardrails":"pass","asi":{"mechanism":"per-state CORAL: X -> (X-mp) W + mp with W built from Cp,C9 symmetric roots, eigenvalues floored at 1e-8; 22 states","learned":"STRONG NEGATIVE with a clean diagnosis: variogram +55% worse (0.1155 vs 0.0743), de -5.6%, nmmd unchanged. Root cause: baseline rows ARE E9.5 cells, so the per-state covariance ALREADY matches E9.5 up to sampling noise. Re-colouring an already-matching covariance can only amplify estimation noise (near-singular directions dominate the inverse square root), which the variogram channel detects immediately. clip 44.7% is the visible symptom.","implication":"the baseline sits at the data ceiling for joint structure on this board; covariance/whitening surgery is a DEAD axis (consistent with the lg0 L-002 finding that 'better solve of the same objective' is dead on T2). Gains must come from the marginal/quantile channel (QTE) or the fixed-geometry channels.","next":"QTE-quadratic: same quantile machinery but a 3-node Lagrange extrapolation in quantile space using E8.25/E8.75/E9.5 (h_n2's curvature idea, applied to full marginals instead of the mean)"}}
{"iter":14,"kind":"experiment","phase":"C","generator":".auto/generate_qte_quad.py","method":"qte_lagrange3_quantile_space","verdict":"discard","primary":{"name":"COMPOSITE","value":-6.5606},"metrics":{"de_score":0.0959,"de_direction":0.3453,"neighborhood_mmd":0.19501,"variogram":0.087091,"mmd_u":0.09625,"variance_ratio":3.302,"clip_fraction":0.017},"gains":{"de":-0.30,"dir":-0.182,"mmd_u":0.0805,"vario":-0.1728,"nmmd":0.0493},"guardrails":"FAIL (variance_ratio 3.302 outside [0.8,1.6]) -> discard regardless","asi":{"mechanism":"same marginal-mapping as iter12 but 3-node Lagrange extrapolation of the quantile function (E8.25/E8.75/E9.5 -> t=10.5); 5 states quad, 17 unchanged","learned":"higher-order extrapolation OVERSHOOTS in quantile space: variance_ratio 3.30x, de collapses to 0.0959 (-61%), vario +17% worse. Two channels did improve (mmd_u -8.1%, nmmd -4.9%) but the composite and guardrails both fail. The genomic time trend near E9.5->E10.5 is NOT quadratic in quantile space; the honest reading is that linear (iter12) is the right order for this family and curvature is over-fitting the three available time points.","discipline_note":"a 'damped quadratic' (alpha<1 on the curvature term) would be a knob scan to rescue a failed axis -> NOT pursued; recorded in ideas.md as refused.","next":"combination test: iter12's QTE marginals x x_n3's composition-trend resample (composition is the only channel family that has ever moved d2/occ/scale, because resampling changes the coordinate mix)"}}
{"iter":15,"kind":"experiment","phase":"C","generator":".auto/generate_qte_compmix.py","method":"qte_marginal_x_compmix_resample_3seed","verdict":"keep","new_local_champion":true,"persisted":"artifacts/autoresearch/t2-extrap-20261001-v1/submission.iter15-qtecompmix.h5ad (median seed 20261008, sha 1b0d17d9dedf3b41…)","primary":{"name":"COMPOSITE","value":3.4636},"prev_champion":2.3768,"three_seed":{"20260929":3.0475,"20261007":3.8677,"20261008":3.4636},"min":3.0475,"gains_median_seed":{"de":0.0556,"dir":0.049,"mmd_u":0.0864,"vario":0.04,"d2":-0.0203,"occ":0.0048,"scale":-0.0111,"nmmd":0.0727},"guardrails":"pass_all_3_seeds","asi":{"mechanism":"iter12 QTE marginals applied to the full baseline, then x_n3's frozen compmix plan (log-ratio share trend, max_fold 2.0, largest-remainder counts, select_rows) chooses the rows; 3 seeds","learned":"DID NOT need a new invention — COMBINING the two channels wins: median +3.464 vs QTE alone +2.377 vs compmix alone +0.931. Every seed beats the previous champion (min 3.0475 > 2.3768) and all guardrails pass, so this is the most robust result so far. Channel decomposition of the gain: marginal channel drives de (+5.6%) and vario (+4.0%); composition channel adds dir (+4.9% vs +0.3% for QTE alone), mmd_u (+8.6% vs +4.9%) and nmmd (+7.3% vs +3.4%) — the two mechanisms are complementary, not redundant. Geometry channels now move slightly (d2 -2.0%, occ +0.5%, scale -1.1%) purely because the row mix changed.","caveat":"resampling design: seed spread 3.05-3.87 (0.82 wide) so the median verdict matters; local-only, proxy rho=0.54, NOT a server claim","next":"continue the sweep with structurally different families to try to beat +3.464: low-rank SVD delta projection, robust trimmed delta, per-gene LOOCV model selection, ensemble of top-2"}}
{"kind":"diagnostic_added","phase":"C","date":"2026-10-01","what":"EXPR_COMPOSITE = mean of the 5 EXPRESSION channels only (de, dir, mmd_u, vario, nmmd) added to composite.py as an ADDITIVE diagnostic","why":"3 of the 8 frozen channels are geometry (d2/occ/scale) and move only when resampling changes the row mix; the proxy target is an E9.5 cardiac SUBSET, so geometry gains can be subset artifacts rather than real improvements. EXPR_COMPOSITE is reported so a composite win cannot hide behind geometry-proxy artifacts. PRIMARY DEFINITION UNCHANGED (still all 8 channels)."}
{"iter":16,"kind":"experiment","phase":"C","generator":".auto/generate_svddelta.py","method":"low_rank_svd_delta_energy0.90","verdict":"discard","primary":{"name":"COMPOSITE","value":-1.3811},"expr_composite":-2.2098,"metrics":{"de_score":0.2466,"de_direction":0.4275,"variogram":0.080878,"mmd_u":0.1067,"neighborhood_mmd":0.20555,"clip_fraction":0.2027},"gains":{"de":0.0,"dir":0.0128,"mmd_u":-0.0193,"vario":-0.0891,"nmmd":-0.0149},"guardrails":"pass","asi":{"mechanism":"SVD of the (5 states x 500 genes) per-state mean-shift matrix, reconstruct at rank 4 (energy 0.9488, frozen >=0.90 rule), apply denoised delta as a mean shift to the frozen baseline","learned":"wrong axis again: de EXACTLY unchanged (0.0 gain) — the 7th consecutive mean-shift-family design pinned on the DE channel — while vario gets 8.9% WORSE, mmd_u and nmmd worse. Cross-state SVD denoising of a mean shift cannot help: the marginal shape, not the mean, is what moves this board's expression channels.","implication":"MEAN-SHIFT FAMILY DEFINITIVELY CLOSED (baseline-delta, cap, shrink C=1/C=2 f32/f64, adaptive, lateref, trend3, lineage, SVD-denoised). Do not spend further iterations on delta estimators; only full-marginal (quantile) and composition mechanisms move the composite.","next":"significance-gated QTE: keep the winning marginal mapping but only move (state,gene) pairs whose temporal shift passes a BH-FDR 0.05 gate — a principled denoiser on the winning axis instead of on the dead one"}}
{"iter":17,"kind":"experiment","phase":"C","generator":".auto/generate_qte_gated.py","method":"qte_fdr_gated_0.05","verdict":"discard","reason":"gate saturated","primary":{"name":"COMPOSITE","value":2.3768},"expr_composite":3.8029,"gains":{"de":0.0556,"dir":0.0031,"mmd_u":0.0486,"vario":0.0489,"nmmd":0.034},"guardrails":"pass","asi":{"mechanism":"Welch t on E8.75 vs E9.5 per (state,gene) + BH-FDR 0.05 gate over 2500 pairs, then iter12 QTE on passing pairs only","learned":"NEGATIVE but informative: the gate kept 2500/2500 pairs (every kept_frac = 1.0). With ~2500-5000 cells per state, EVERY gene shows a statistically significant temporal shift, so significance gating cannot denoise this axis — there is no 'noise genes' subset to protect. Result is bit-identical in behaviour to iter12 (composite 2.3768, same gains).","implication":"denoising ideas for the marginal channel must be structural (e.g. match in the metric's own PC space), not significance-based.","next":"PC-space quantile matching: mmd_u/neighborhood_mmd are computed in 30-PC space, so extrapolate the PC-score marginals directly (delta in PC space added to the ORIGINAL full-rank residuals, so only the 30-PC shift changes)"}}
{"iter":18,"kind":"experiment","phase":"C","generator":".auto/generate_qte_pc.py","method":"qte_in_pc_space_30","verdict":"discard","primary":{"name":"COMPOSITE","value":-0.6015},"expr_composite":-0.9624,"gains":{"de":-0.0556,"dir":0.0085,"mmd_u":-0.0027,"vario":0.0118,"nmmd":-0.0102},"guardrails":"pass","metrics":{"de_score":0.2329,"variogram":0.073385,"clip_fraction":0.2353},"asi":{"mechanism":"PCA(30) on baseline rows; per state extrapolate PC-score quantiles Qpred=Q9+(Q9-Q8); apply only the PC delta back to gene space so residuals survive","learned":"de -5.6% and mmd_u/nmmd slightly worse; only vario improved (+1.2%). Despite mmd_u being PC-based, matching marginals in 30-PC space does NOT beat per-gene matching (iter12 +3.80 expr). 30 PCs carry only 45.6% of the variance, so PC-space moves are large and clip 23.5% of entries.","implication":"GENE-SPACE marginal mapping is the winning space. Two of three alternative spaces tested (PC, covariance) lose; the mean is dead.","next":"time-normalized QTE: iter12 extrapolates one unit of time from a 0.75-unit interval, i.e. it UNDER-extrapolates by construction. Scaling the quantile shift by dt_target/dt_source = 1.0/0.75 = 4/3 is the canonical linear rule and matches the project's own earlier 'time1333' lane convention (v0009) — a principled correction, not a knob"}}
{"iter":19,"kind":"experiment","phase":"C","generator":".auto/generate_qte_time.py","method":"qte_time_normalized_4over3","verdict":"record_only_not_champion","primary":{"name":"COMPOSITE","value":2.6084},"expr_composite":4.1735,"gains":{"de":0.0556,"dir":0.018,"mmd_u":0.0543,"vario":0.042,"nmmd":0.0389},"guardrails":"pass","asi":{"mechanism":"iter12 QTE with the extrapolation distance corrected: Qpred = Q9 + (4/3)(Q9-Q8), because the estimation interval is 0.75 time units while the target is 1.0 away. Matches the project's own earlier 'time1333' mean-shift convention (v0009), so it is a principled correction rather than a searched factor (4/3 is arithmetic, no scan).","learned":"improves the pure-marginal design over plain QTE: composite +2.608 vs +2.377, expr +4.174 vs +3.803, with de/mmd_u/vario/nmmd all higher and dir +1.8% (vs +0.3%). Under-extrapolation was real but small. Does not beat the QTE x compmix champion on its own.", "next":"apply the same time correction inside the champion (combination) - iter20"}}
{"iter":20,"kind":"experiment","phase":"C","generator":".auto/generate_qte_time.py --compmix","method":"qte_time_normalized_4over3_x_compmix_3seed","verdict":"keep","new_local_champion":true,"persisted":"artifacts/autoresearch/t2-extrap-20261001-v1/submission.iter20-qte-time-compmix.h5ad (sha dc811606fafdbbec…)","primary":{"name":"COMPOSITE","value":3.913},"expr_composite":6.3022,"prev_champion":3.4636,"three_seed":{"20260929":3.913,"20261007":4.0088,"20261008":3.6058},"min":3.6058,"gains_median_seed":{"de":0.0556,"dir":0.0595,"mmd_u":0.0894,"vario":0.0351,"d2":-0.0203,"occ":0.0048,"scale":-0.0111,"nmmd":0.0756},"guardrails":"pass_all_3_seeds","asi":{"mechanism":"champion = time-normalized QTE marginals (4/3) + x_n3 compmix resample; 3 seeds","learned":"BEST RESULT OF THE WHOLE AUTORESEARCH SESSION: median +3.913 (prev champion +3.464, prev best-prior-lane +1.709) and median expr +6.302 (prev +6.074). ALL THREE seeds beat the old champion (min 3.6058), all guardrails pass. Channel profile of the winner: dir +6.0%, mmd_u +8.9%, nmmd +7.6% (composition channels, strongest), de +5.6%, vario +3.5% (marginal channels). The two mechanisms plus the time correction compound: 1.709 (prior best) -> 2.377 (QTE) -> 3.464 (x compmix) -> 3.913 (time-corrected).","robustness":"seed spread 3.606-4.009; median reported and the median seed persisted (anti-luck rule)"}}
{"iter":21,"kind":"experiment","phase":"C","generator":".auto/generate_shareqte.py","method":"share_lin_trend_composition_x_qte_time4over3","verdict":"discard","guardrails":"FAIL all 3 seeds","primary":{"name":"COMPOSITE","value":0.855},"expr_composite":11.479,"best_expr_ever":true,"three_seed_composite":{"20260929":0.5219,"20261007":0.855,"20261008":1.4404},"expr_by_seed":{"20260929":11.066,"20261007":11.479,"20261008":12.228},"gains_median_seed":{"de":0.0556,"dir":0.1459,"mmd_u":0.1424,"vario":0.0541,"d2":-0.30,"occ":0.0028,"scale":-0.2084,"nmmd":0.1759},"asi":{"mechanism":"swapped the composition algorithm from x_n3's log-ratio+max_fold2.0 plan to the goal-round e_r1 log-linear share trend (ops.share_series_predict) on top of time-normalized QTE","learned":"HIGHEST EXPRESSION COMPOSITE EVER MEASURED: +11.48 median (champion +6.30), with dir +14.6%, mmd_u +14.2%, nmmd +17.6%, vario +5.4%. BUT it fails the frozen guardrails on all three seeds and the geometry channels collapse systematically (d2 -0.30 winsorized = >30% worse, scale -0.21 = ~30% worse, consistent across seeds, NOT a row lottery). Diagnosis: the log-linear share trend over-shifts the composition (it extrapolates 1.0 time units from a 0.5-unit trend with no cap, unlike x_n3's max_fold 2.0 cap), and the resulting row mix distorts the point cloud's shape and extent.","lead":"the expression channel has ~2x headroom beyond the current champion and the binding constraint has moved to the companion channels; a composition algorithm that is BOTH aggressive on shares and geometry-preserving is the highest-value open direction. Candidate principled version (NOT run, would need a data-frozen damping rule rather than a scanned factor): cap per-state share change at the largest change observed between two consecutive real stages.","discipline":"no damping factor was scanned to rescue this; recorded as a lead instead"}}
{"kind":"round_summary","phase":"C","date":"2026-10-01","file":".auto/ROUTE_C_SUMMARY.md","copy":"artifacts/autoresearch/t2-extrap-20261001-v1/ROUTE_C_SUMMARY.md","sweep_count":10,"champion":{"method":"qte_time_normalized_4over3_x_compmix","composite":3.913,"expr_composite":6.3022,"artifact":"artifacts/autoresearch/t2-extrap-20261001-v1/submission.iter20-qte-time-compmix.h5ad","sha256_prefix":"dc811606fafdbbec","contract":"fail_by_design_accepted_4_mass_exemptions","registered":false,"uploaded":false},"baseline_champion_before_round":{"label":"x_o2_shrinkcomp","composite":1.709},"proxy_validity":{"spearman":0.5385,"n":12},"leads":["geometry-preserving aggressive composition (data-frozen share-change cap)","ensemble of champion variants on shared row plan","growth-trend geometry extrapolation (needs frozen rule)"],"recommendation":"user chooses: (1) server read via coordinator INDEX row + manual upload, or (2) hold and pursue the geometry-preserving lead"}
{"kind": "metrics_backfill", "phase": "C", "date": "2026-10-01", "why": "iters 15/19/20/21 logged gains+composite but not the full metric vector; champion re-scored from the persisted artifact for ledger completeness", "champion_artifact": "artifacts/autoresearch/t2-extrap-20261001-v1/submission.iter20-qte-time-compmix.h5ad", "metrics": {"de_score": 0.2603, "de_direction": 0.4472, "mmd_u": 0.09532, "variogram": 0.071657, "d2_shape": 0.01561, "occupancy_dice": 0.8246, "scale_log_ratio": 0.2179, "neighborhood_mmd": 0.18962, "energy_distance": 3.6142, "pseudobulk_pearson": 0.8007, "variance_ratio": 1.461, "library_size_ratio": 1.0, "pb_rel_err": 0.541, "morans_I_agreement": 0.7975}, "composite": 3.605816389711828, "expr_composite": 6.302231981921176, "gains": {"de": 0.0555555555555554, "dir": 0.059464581852641585, "mmd_u": 0.08941536110049669, "vario": 0.03506551218001367, "d2": -0.020261437908496813, "occ": 0.00475204094066043, "scale": -0.011136890951276164, "nmmd": 0.07561058840735141}}
{"kind":"correction","phase":"C","date":"2026-10-01","what":"iter20 champion artifact was persisted as the LOWEST seed, not the median-value seed","detail":"iter20 3-seed composites {20260929: 3.913, 20261007: 4.0088, 20261008: 3.6058}. The median VALUE is 3.913, which belongs to seed 20260929, but the first persist script had been sed-patched to SEEDS=[20261008] (the lowest). Files are now explicit: submission.iter20-qte-time-compmix.seed20260929.h5ad sha 8bb6e4706b6bf4bd (composite 3.913 / expr 6.8119) = median representative; submission.iter20-qte-time-compmix.seed20261008.h5ad sha dc811606fafdbbec (3.6058 / 6.3022) = lowest. NO silent replacement: both kept, both hashes recorded. Earlier log entries quoting sha dc811606 as 'the champion, median seed' are superseded by this entry.","seed20261007_max":"composite 4.0088 (not persisted; max, kept out per the anti-luck rule)","lesson":"persist scripts patched by sed must be re-read before running; a 'median seed' claim needs the seed-to-value mapping checked, not assumed"}
