{"kind": "packaged_for_upload", "phase": "C", "date": "2026-10-02", "zip": "/home/huyudi/014_virtualEmbryo/deliveries/arcqte__t2__upload__20261002.zip", "zip_sha256": "f51e79a397c7f5d77b916decee35dc6ccb41523180daaa9fb60145d3d9565f4c", "run_id": "AR-ROUTE-C-20261002-v1", "group": "AR-ROUTE-C-20261002", "members": [{"member": "t2_hrt_ext__qte_tc_s929__v0024.h5ad", "version": "v0024", "sha256": "8bb6e4706b6bf4bd20bf2100b3aa4c62dcf91b06f71392c47c95e9103405f5a8", "bytes": 118758286, "contract": "pass_with_deviation", "local_composite": 3.913, "local_expr_composite": 6.8119, "seed": 20260929, "role": "CHAMPION (median-value seed of 3)", "canonical": "submissions/candidates/T2_heart_val_extrap/v0024_qte_tc_s929/submission.h5ad"}, {"member": "t2_hrt_ext__qte_compmix__v0025.h5ad", "version": "v0025", "sha256": "1b0d17d9dedf3b4183e1d1b475ce7afa72e791533767d9f96c23a12a40b1ac43", "bytes": 118770494, "contract": "pass_with_deviation", "local_composite": 3.4636, "local_expr_composite": 6.074, "seed": 20261008, "role": "robust runner-up (3 seeds all > old champion)", "canonical": "submissions/candidates/T2_heart_val_extrap/v0025_qte_compmix/submission.h5ad"}, {"member": "t2_hrt_ext__qte_time__v0026.h5ad", "version": "v0026", "sha256": "2e7cbc4b3f03170fb2eae43c9e78ca443ce3bf7fa9c187a08ebf06915c137ab2", "bytes": 118618942, "contract": "pass", "local_composite": 2.6084, "local_expr_composite": 4.1735, "seed": null, "role": "deterministic marginal-only design (NO resampling: zero seed risk)", "canonical": "submissions/candidates/T2_heart_val_extrap/v0026_qte_time/submission.h5ad"}, {"member": "t2_hrt_ext__sharetrend_qte__v0027.h5ad", "version": "v0027", "sha256": "6f4dbe1cbaed012dcba6e8325ba1838a33330427be18b36e0cf845e103e111ec", "bytes": 119741326, "contract": "pass_with_deviation", "local_composite": 0.855, "local_expr_composite": 11.479, "seed": 20261007, "role": "DIAGNOSTIC PROBE, OPTIONAL (skip for promising-only): median seed of {0.522, 0.855, 1.440}; known defect library_size_ratio=11.98 (12x) + variance_ratio 1.74 -> local guardrails FAIL; highest expression composite ever (11.5) so it tests whether the server rewards the marginal/expression profile or punishes composition aggressiveness", "canonical": "submissions/candidates/T2_heart_val_extrap/v0027_sharetrend_qte/submission.h5ad"}, {"member": "t2_hrt_ext__qte_tc_s008__v0028.h5ad", "version": "v0028", "sha256": "dc811606fafdbbec69665d936bebefafae3121096f69dae0de4e58a09753a1af", "bytes": 118770494, "contract": "pass_with_deviation", "local_composite": 3.6058, "local_expr_composite": 6.3022, "seed": 20261008, "role": "seed-replication probe (identical design to v0024, different rows: measures server-side row-luck)", "canonical": "submissions/candidates/T2_heart_val_extrap/v0028_qte_tc_s008/submission.h5ad"}], "index": "5 rows appended to submissions/INDEX.tsv (score_pending); board-scoped uniqueness checked; append-only", "governance": ["docs/coordination/T2_TRACKING.md +1 line", "docs/coordination/DECISIONS.md D-20261002-ARROUTEC-001", "DECISIONS.md index line", "TODO.md change record"], "registry": "NOT touched (score return only)", "artifacts_parked": ["v0027_sharetrend_qte.pre-rebuild-ad09bad18781.h5ad (earlier max-seed build, parked not overwritten)"], "recommended_upload_order": ["v0024 (champion)", "v0025 (robust runner-up)", "v0026 (deterministic, no seed risk)", "v0028 (seed-replication probe)", "v0027 (optional diagnostic; known 12x library defect)"], "reminder": "user uploads manually; on score return register SERVER_SCORE_REGISTRY + SERVER_SUBMETRIC_REGISTRY and re-read the portal total (50.74-vs-50.53 OPEN)"}
{"kind":"correction","phase":"C","date":"2026-10-02","what":"version collision on T2:heart:val_extrap v0024 (arcomp vs qte_tc_s929)","facts":"INDEX.tsv contained NO arcomp row and NO v0024_arcomp canonical path; the only registered extrap v0024 is qte_time_compmix_seed929 (sha 8bb6e470…, group AR-ROUTE-C-20261002). The arcomp v0024 was a PROPOSED id in the 2026-10-01 t2arex package (receipt: READY_NOT_REGISTERED, lane recommendation AGAINST upload) that was never registered.","authoritative":"v0024 = t2_hrt_ext__qte_tc_s929__v0024.h5ad (sha 8bb6e4706b6bf4bd20bf2100b3aa4c62dcf91b06f71392c47c95e9103405f5a8) — per INDEX.tsv + canonical path.","actions":["renamed deliveries/t2arex__t2__upload__20261001.zip -> ...VOID-do-not-upload.zip","rewrote its receipt to status VOID_DO_NOT_UPLOAD with both reasons (collision + withdrawn science)","added VOID README beside it","prepended a VOID banner to artifacts/autoresearch/t2-extrap-20261001-v1/HANDOFF.md (original text retained)","clarified the registered v0024 INDEX note to record that it supersedes the unregistered arcomp reservation"],"root_cause":"I allocated v0024 as a proposed id in the Route B package, then reused the same number for the Route C champion and registered only the latter; the earlier package should have been renumbered or voided at that moment.","process_fix":"version reservation is only valid once the INDEX row exists; any earlier unregistered package claiming the same version must be voided in the same work step as the registration","reminder":"if the comp-only probe is ever wanted on the server, assign a fresh version >= v0029 and register it first"}
{"type":"config","name":"T1 report-proxy local optimization (de_score higher better; server champions would NOT keep on this primary — local-record only)","metricName":"de_score","metricUnit":"","bestDirection":"lower"}
{"phase":"T1","iter":0,"kind":"baseline","generator":null,"candidate":"artifacts/t1_three/T1-THREE-20260929-v1/r2joint/report_prediction.h5ad","verdict":"keep","primary":{"name":"de_score","value":0.5926,"direction":"higher"},"metrics":{"de_score":0.5926,"de_direction":0.5852,"energy_distance":0.14221,"mmd_u":0.00937,"variogram":0.000398,"pb_rel_err":0.0507,"library_size_ratio":1.0,"variance_ratio":1.029,"composition_JSD":0.0799,"pseudobulk_pearson":0.9985,"wall_s":81.0},"asi":{"note":"T1 report-proxy baseline = v0035 design at report scope; harness re-measured 2026-10-02 reproduces recorded EVALUATION.json exactly (deterministic scorer, seed 20260921). Proxy-validity warning stands: server champions v0038/v0043 score de=0.5926 locally — this primary would not keep them; all keeps local-record only","next":"T1-1 bootstrap luck-band probe (3 seeds, pure row-identity noise meter) before any mechanism trial"}}
{"phase":"T1","iter":1,"kind":"experiment","generator":".auto/generate_t1_boot.py","method":"bootstrap_within_report_3seed_noise_probe","verdict":"discard","bar_honored":"median_gt_baseline_and_min_ge_baseline","primary":{"name":"de_score","direction":"higher"},"three_seed_de":{"20261011":0.5741,"20261012":0.5741,"20261013":0.6111},"median_de":0.5741,"min_de":0.5741,"metrics_per_seed":{"20261011":{"de":0.5741,"dir":0.5833,"energy":0.15484,"mmd":0.00953,"vario":0.000408},"20261012":{"de":0.5741,"dir":0.5692,"energy":0.15668,"mmd":0.00932,"vario":0.000412},"20261013":{"de":0.6111,"dir":0.5675,"energy":0.16788,"mmd":0.00956,"vario":0.000441}},"guardrails":"pass_all_3","asi":{"mechanism":"within-type resample-with-replacement of the v0035 report matrix, same counts, 3 seeds — zero mechanism, pure row-identity noise meter","learned":"HEADLINE: pure noise spans de 0.5741-0.6111 (±0.018 around baseline); one noise seed BEATS baseline (+0.0185) with guardrails passing. T1 luck band ≈ T2 band (±0.02-0.03). Two seeds pin EXACTLY 0.5741 → DE readout is quantized (later confirmed quantum=0.0185 = one-gene flip). Single-seed resampling wins are meaningless; 3-seed median+min bar MANDATORY (this probe correctly discards itself: median 0.5741 < 0.5926)","next":"T1-2 plain per-type QTE marginal (deterministic, immune to row luck)"}}
{"phase":"T1","iter":2,"kind":"experiment","generator":".auto/generate_t1_qte.py","method":"plain_pertype_pergene_quantile_extrap_factor1.0","verdict":"discard","guardrails":"FAIL (energy 0.348 > 0.20 bar)","primary":{"name":"de_score","value":0.6111,"direction":"higher"},"delta_vs_baseline":{"d_de":0.0185,"d_dir":0.0716,"d_energy":0.2058,"d_mmd":0.00088,"d_vario":0.000051},"metrics":{"de_score":0.6111,"de_direction":0.6568,"energy_distance":0.34797,"mmd_u":0.01025,"variogram":0.000449,"pb_rel_err":0.0737,"library_size_ratio":1.045,"variance_ratio":1.182,"composition_JSD":0.1076,"pseudobulk_pearson":0.9969},"asi":{"mechanism":"Qpred=QB+(QB-QA) per type per gene, recipient rank-mapped; 2554 rows mapped / 803 fallback (7 types incl LV-CM/RV-CM/JCF/EXEM); negatives clipped","learned":"D3 SIGNATURE REPRODUCED LOCALLY: dir +0.072 (largest local dir gain on record) but energy 2.4x collapse (0.348) -> guardrail veto. Per-gene marginal synthesis breaks cellwise coexpression on T1; every T1 winner preserved whole rows. de +0.0185 = exactly ONE quantum (0.5926->0.6111), same value pure noise hit in T1-1 — quantum coincidence, not proof of signal. de quantum confirmed 0.0185 across history (0.5741/0.5926/0.6111/0.6296/0.6481 ladder); keep-bar noise floor raised: deterministic needs >= +1 quantum AND guardrails","next":"T1-3 QTE x whole-row projection: steer selection with QTE vectors but output nearest real E9.5-train donor rows (n2covot trick) — tests whether dir gain survives with energy intact"}}
{"phase":"T1","iter":3,"kind":"experiment","generator":".auto/generate_t1_qteproj.py","method":"qte_steered_nearest_donor_whole_row_projection","verdict":"discard","guardrails":"FAIL catastrophically (energy 2.40, mmd 3.5x, vario 12x, dir collapse)","primary":{"name":"de_score","value":0.3889,"direction":"higher"},"delta_vs_baseline":{"d_de":-0.2037,"d_dir":-0.3388,"d_energy":2.254,"d_mmd":0.02303,"d_vario":0.004392},"metrics":{"de_score":0.3889,"de_direction":0.2464,"energy_distance":2.39622,"mmd_u":0.0324,"variogram":0.00479,"pb_rel_err":0.1199,"library_size_ratio":1.0,"variance_ratio":0.635,"composition_JSD":0.0923,"pseudobulk_pearson":0.9943},"asi":{"mechanism":"per-row exact nearest E9.5-train same-type donor to the T1-2 QTE target vector (BLAS exact, 2554 projected / 803 fallback)","learned":"CATASTROPHIC on every channel: QTE targets live so far off the data manifold that nearest-real-donor selection is anti-informative (dir collapses to 0.25). Follows that T1-2's dir +0.072 was itself an off-manifold artifact — energy told the truth, dir without energy is fool's gold (same shape as D3 field-cosine win -> server vario -10.4). Marginal-extrapolation family CLOSED on T1 (plain vetoed, projection catastrophic); whole-row methods only work when the SELECTION signal is on-manifold (density/covOT/mass), not extrapolated targets","next":"T1-4 last disciplined shot: winner-ensemble probe (v0035 x v0038 report-level whole-row 50/50 coin-flip mix, 3 seeds) — do the two server winners compose locally?"}}
{"phase":"T1","iter":4,"kind":"experiment","generator":".auto/generate_t1_mix.py","method":"winner_ensemble_v0035_x_v0038_wholerow_coinflip_3seed","verdict":"discard","bar_honored":"median_gt_baseline_and_min_ge_baseline","primary":{"name":"de_score","direction":"higher"},"three_seed_de":{"20261014":0.5926,"20261015":0.5741,"20261016":0.5926},"median_de":0.5926,"min_de":0.5741,"metrics_per_seed":{"20261014":{"de":0.5926,"dir":0.5847,"energy":0.14573,"mmd":0.00931,"vario":0.000401},"20261015":{"de":0.5741,"dir":0.5826,"energy":0.14471,"mmd":0.00928,"vario":0.0004},"20261016":{"de":0.5926,"dir":0.584,"energy":0.14584,"mmd":0.00931,"vario":0.000403}},"guardrails":"pass_all_3","asi":{"mechanism":"per-slot frozen coin flip picks whole v0035 or v0038 report row (slot order+types verified identical); 3 seeds ~50/50","learned":"median de EQUALS baseline (0.5926, not >) with min below -> DISCARD, no bar-moving. Secondaries are a wash: mmd -1% (inherits v0038 edge) paid back in energy/vario; de flips one quantum on seed luck again. The two server winners do NOT compose at report level under this instrument. Note asymmetry with server s2mix (70/30 full-pipeline mix of a different pair DID compose +0.12): crude report coin-flip cannot adjudicate full-pipeline ensembles — ensemble design stays a lane-level (frozen, contracted) question, out of loop scope","next":"no live report-level axes remain (see terminal entry): marginal closed (veto+catastrophe), resampling luck-quantified, ensemble wash, all remaining variants refused with written reasons. Recommend PAUSE + user pivot decision"}}
{"phase":"T1","kind":"terminal","date":"2026-10-02","iters":5,"standing_keeps":0,"baseline":{"de_score":0.5926,"scope":"v0035 report (3357 slots, seed 20260921)"},"headlines":["H1 luck band + quantum: pure row-identity bootstrap spans de 0.5741-0.6111; one noise seed beats baseline with guardrails passing. DE quantum = 0.0185 (one-gene flip ladder). 3-seed median+min bar correctly discards noise (T1-1, T1-4).","H2 D3-signature reproduced locally: plain QTE gives record local dir +0.072 but energy 2.4x collapse -> veto. Rule: dir-without-energy is fool's gold on T1 (mirrors D3 field-cosine win -> server vario -10.4).","H3 off-manifold steering collapse: QTE-steered nearest-donor projection catastrophic on ALL channels (de -0.20, dir 0.25, energy 17x). QTE targets live off-manifold; T1-2's dir gain was itself an off-manifold artifact.","H4 winners don't compose locally: v0035 x v0038 whole-row 50/50 mix = median de equals baseline, secondaries wash. Report-level coin-flip cannot adjudicate full-pipeline ensembles (server s2mix proved composition at lane scope).","H5 proxy-validity restatement: NO local primary (de, mmd, dir, energy) selects the server champions (v0038 1/1/3, v0043 0/1/4 vs v0035). s1growth had best local mmd yet server -0.52. Local keeps are record-only by construction."],"closed_axes":["mean-shift/shrink (server-swept, C=1 TIE best)","composition-strength up (s1growth -0.52 server)","per-gene marginal synthesis (T1-2 veto; n2param/o1mass server-lost)","QTE-steered projection (T1-3 catastrophic)","report-level winner-mix (T1-4 wash)","rank-metric/median-donor variants (same dead steering — refused, no new info)","significance gating / quadratic time (saturated / intervals equal — refused)","mix-ratio & strength scans (proxy-tuning — refused)"],"leads":["L-T1-1 full-scIMF lane (P0-2: scTimeBench forecast-best; D1 tried VAE+SDE joint and failed — full scIMF untested; needs GPU + frozen lane design, user authorization)","L-T1-2 full-pipeline ensemble of on-manifold selectors (density x covOT) at frozen ratio with contract — lane scope only, never report-level","L-T1-3 energy-constrained direction search: any future dir-chasing design must carry energy/mmd/vario vetoes from the first run (doctrine from H2)"],"recommendation":"PAUSE T1 report-level loop (no live axes; further iters = thrash). User pivot options: (a) close T1 autoresearch, keep findings as doctrine; (b) authorize a frozen full-pipeline lane from L-T1-1/L-T1-2 (coordinator scope, not loop scope); (c) redirect loop to a new primary ONLY on user call (dir-primary refused by H2 unless vetoes bind from run 1). No auto-submit; nothing in this phase touches INDEX/registry/submissions.","overfit_statement":"No E10.5 truth read; target_used=false throughout; eval-target file never opened for fitting (train pools via frozen SPLITS only); each mechanism single-shot data-frozen, no scans; repeatedly-used report split disclosed as non-independent in every entry."}
{"phase":"T1","kind":"policy","date":"2026-10-02","what":"user overruled anti-overfit emphasis: server score is king; hidden test untouchable so direct overfit impossible","response":"conceded rhetoric was excessive; real surfaces are proxy-Goodhart + server TIE noise (evidenced, one line from now on)","new_policy":"local ring = disaster filter (energy-class vetoes, which predicted D3) + diversity candidate generator; keep bar loosened to median>=baseline + guardrails (min>=baseline dropped); report-level scans allowed as candidate generators with honest curve reporting; nothing eliminated locally — server alone eliminates; goal: 3-5 mechanistically diverse report candidates for full-pipeline conversion + server arbitration","note":"frozen-design-before-server-scoring and contract/target_used rules unchanged (legitimacy, not conservatism)"}
{"phase":"T1","iter":5,"kind":"experiment","generator":".auto/generate_t1_pairmix.py","method":"winner_pair_r2joint_x_r3mix_stratified_mix_fractionscan_plus_4seed","verdict":"record","policy":"loosened_20261002_median_ge_baseline","primary":{"name":"de_score","direction":"higher"},"fraction_curve_seed20260921":{"0.5":{"de":0.5926,"dir":0.5686,"energy":0.14593,"mmd":0.00988,"vario":0.000395},"0.7":{"de":0.5926,"dir":0.5734,"energy":0.15987,"mmd":0.00919,"vario":0.000437},"0.85":{"de":0.5926,"dir":0.5822,"energy":0.1511,"mmd":0.00959,"vario":0.000413}},"four_seed_f07":{"20260921":0.5926,"20261017":0.6111,"20261018":0.5926,"20261019":0.5926},"median_de_f07":0.5926,"guardrails":"pass_all","persisted":{"candidate":"artifacts/autoresearch/t1-20261002-v1/report.t1-5-pairmix070-s20261018.h5ad","sha256":"cc2109fb92328d2179a3d369162ff1bb42bd87912b71aac855be683eba823ed1","diag":"artifacts/autoresearch/t1-20261002-v1/DIAG.t1-5-s20261018.json"},"asi":{"mechanism":"stratified whole-row mix of the actual winner-pair reports (r2joint=v0035 x r3mix=v0036); slot order verified identical; donor-correct obs rebuilt (shuffle-aware)","learned":"de PINNED at 0.5926 across all fractions and 3/4 seeds (4th flips one quantum +0.0185 — luck, honestly reported). Fraction trades mmd (-1.9% at 0.7) vs energy/vario; no fraction dominates. Best-behaved realization s20261018: energy -2.9% AND vario -1.8% jointly beat baseline with de pinned and guardrails clean — first design in this phase with two distribution secondaries jointly better and nothing catastrophic. Recorded as candidate material (report scope, not submission).","next":"T1-6 mild composition-tilt probe (type counts halfway toward E9.5-train proportions, whole-row, deterministic) — mild strength untested (s1growth tested stronger-at-full and lost)"}}
{"phase":"T1","iter":6,"kind":"experiment","generator":".auto/generate_t1_comptilt.py","method":"mild_composition_tilt_halfway_to_train95_3seed","verdict":"record_negative","primary":{"name":"de_score","direction":"higher"},"three_seed":{"20261020":{"de":0.5556,"dir":0.5796,"energy":0.16997,"mmd":0.01108,"vario":0.000444,"cjsd":0.0929},"20261021":{"de":0.5185,"dir":0.5784,"energy":0.18951,"mmd":0.0107,"vario":0.00048,"cjsd":0.0921},"20261022":{"de":0.537,"dir":0.5791,"energy":0.16759,"mmd":0.01062,"vario":0.000429,"cjsd":0.0942}},"median_de":0.537,"guardrails":"pass_all_3","asi":{"mechanism":"type counts halfway v0035-report -> E9.5-train props (largest-remainder + pro-rata top-up; E9.5-train vocab covers only 52% of report mass — same 7 missing types as T1-2 fallback)","learned":"CLEAR NEGATIVE on all 3 seeds: de -2 to -4 quanta, energy/mmd/vario all worse, and composition_JSD itself worsens (0.093 vs 0.080) — train95 and outer95 compositions differ enough that tilting toward train moves AWAY from the eval target. Consistent with s1growth server loss (-0.52). Composition-tilt axis closed at both strengths (stronger-at-full lost, mild-at-report loses); the fixed composition (v0024/v0029-lineage quotas) stands","bug_note":"first version asserted on want-sum (raw need not sum to tot when vocabs mismatch); fixed with pro-rata top-up, no score from the broken version was ever logged (stale-file scores caught before logging)","next":"T1-7 density-temperature tilt on the joint draw (T in {0.5, 2.0} vs T=1.0 exact-repro control) — last cheap on-manifold knob; then package diversity set or pause"}}
{"phase":"T1","iter":7,"kind":"experiment","generator":".auto/generate_t1_pairmix.py","method":"pairmix_35x38_frac0.7_3seed","verdict":"record","policy":"loosened_20261002_median_ge_baseline","primary":{"name":"de_score","direction":"higher"},"three_seed":{"20261023":{"de":0.6111,"dir":0.5777,"energy":0.15351,"mmd":0.00948,"vario":0.000416},"20261024":{"de":0.5741,"dir":0.5761,"energy":0.15823,"mmd":0.00932,"vario":0.000418},"20261025":{"de":0.6296,"dir":0.5728,"energy":0.14399,"mmd":0.00936,"vario":0.000403}},"median_de":0.6111,"guardrails":"pass_all_3","persisted":{"candidate":"artifacts/autoresearch/t1-20261002-v1/report.t1-7-pairmix3538f070-s20261023.h5ad","sha256":"see_DIAG","diag":"artifacts/autoresearch/t1-20261002-v1/DIAG.t1-7-s20261023.json"},"asi":{"mechanism":"stratified whole-row 70/30 mix, v0035-report x v0038-report (joint-selector x covOT-projector — the two server-winning mechanisms); donor-correct obs","learned":"median de 0.6111 (+1 quantum) >= baseline, guardrails clean on all seeds -> record. Range spans 3 quanta (0.5741-0.6296): mix ROLLS the quantum dice rather than lifting systematically — honestly reported. Best seed (0.6296, +2q) is guardrail-clean (energy 0.144 ~ baseline). Full-pipeline analogue is a concrete cheap lane (70/30 v0035-final x v0038-final stratified mix, same construction as server-winning s2mix with a new pair).","next":"T1-8 completes the pair square (36x38 @0.7); then package diversity set + user report"}}
