{"iter":0,"kind":"baseline","generator":null,"candidate":"submissions/scored/baseline-001/T2_heart_val_extrap/submission.h5ad","verdict":"keep","primary":{"name":"de_score","value":0.2466,"direction":"higher"},"metrics":{"de_score":0.2466,"de_direction":0.4221,"neighborhood_mmd":0.20513,"morans_I_agreement":0.8044,"variogram":0.074261,"mmd_u":0.10468,"energy_distance":3.49285,"pseudobulk_pearson":0.7913,"variance_ratio":1.227,"occupancy_dice":0.8207,"d2_shape":0.0153,"sliced_wasserstein":0.04086,"scale_log_ratio":0.2155,"count_log_ratio":0.7342,"library_size_ratio":1.0,"pb_rel_err":0.5521,"wall_s":14.0},"asi":{"note":"locked baseline parent reproduces record values exactly; noise floor unknown (single run); confidence n/a"}}
{"iter":1,"kind":"experiment","generator":".auto/generate_blend05.py","method":"late_anchor_blend_alpha0.5","verdict":"discard","primary":{"name":"de_score","value":0.2329,"direction":"higher"},"delta_vs_baseline":{"d_de_score":-0.0137},"metrics":{"de_score":0.2329,"de_direction":0.4362,"neighborhood_mmd":0.20887,"morans_I_agreement":0.8069,"variogram":0.078162,"mmd_u":0.10768,"energy_distance":3.75224,"pseudobulk_pearson":0.771,"variance_ratio":1.291,"occupancy_dice":0.8207,"d2_shape":0.0153,"sliced_wasserstein":0.04086,"scale_log_ratio":0.2155,"count_log_ratio":0.7342,"library_size_ratio":1.0,"pb_rel_err":0.5757,"wall_s":18.0},"asi":{"mechanism":"interior blend of baseline-shift (alpha=1) and x_r1-lateref (alpha=0); 5 shared states, clip 0.2248","learned":"de drops to x_n1-level (0.2329); dir/variogram/morans tick up but nmmd/energy/pb all worsen — late anchor adds magnitude without DE discrimination; interior is not a free lunch","next":"try magnitude-capped blend (per-gene cap at 2xSE) or alpha=0.25 before abandoning anchor axis; then per-state adaptive shrinkage"}}
{"iter":2,"kind":"experiment","generator":".auto/generate_blend025.py","method":"late_anchor_blend_alpha0.25","verdict":"discard","primary":{"name":"de_score","value":0.2192,"direction":"higher"},"delta_vs_baseline":{"d_de_score":-0.0274},"metrics":{"de_score":0.2192,"de_direction":0.4333,"neighborhood_mmd":0.20919,"morans_I_agreement":0.8079,"variogram":0.078162,"mmd_u":0.10814,"energy_distance":3.76655,"pseudobulk_pearson":0.7696,"variance_ratio":1.292,"occupancy_dice":0.8207,"d2_shape":0.0153,"sliced_wasserstein":0.04086,"scale_log_ratio":0.2155,"count_log_ratio":0.7342,"library_size_ratio":1.0,"pb_rel_err":0.5772,"wall_s":14.0},"asi":{"mechanism":"same blend machinery as iter1, ALPHA 0.5->0.25 (closer to x_r1-lateref endpoint)","learned":"de drops FURTHER to 0.2192 (-0.0274); three points now monotonic: alpha=1.0:0.2466 > 0.5:0.2329 > 0.25:0.2192. Late-anchor magnitude dose-dependently HURTS local DE. Yet x_r1 (alpha=0) holds numeric server-high 50.74 — proxy/server inversion on this axis confirmed in both directions. Anchor-blend axis CLOSED for local optimization (alpha=0.75 skipped: monotonic trend makes it predictable ~0.24, no info gain)","next":"magnitude-capped baseline delta (per-gene cap at 2xSE): tests whether DE loss comes from large noisy gene shifts rather than anchor choice"}}
{"iter":3,"kind":"experiment","generator":".auto/generate_cap2se.py","method":"baseline_delta_capped_K2.0","verdict":"discard","primary":{"name":"de_score","value":0.2466,"direction":"higher"},"delta_vs_baseline":{"d_de_score":0.0},"metrics":{"de_score":0.2466,"de_direction":0.4238,"neighborhood_mmd":0.20518,"morans_I_agreement":0.805,"variogram":0.075225,"mmd_u":0.10482,"energy_distance":3.51208,"pseudobulk_pearson":0.7899,"variance_ratio":1.228,"occupancy_dice":0.8207,"d2_shape":0.0153,"sliced_wasserstein":0.04086,"scale_log_ratio":0.2155,"count_log_ratio":0.7342,"library_size_ratio":1.0,"pb_rel_err":0.5536,"wall_s":14.0},"asi":{"mechanism":"baseline d=mu95-mu875 with per-gene cap |d|<=2xSE; 63.6% entries hit cap, 5 shared states, clip 0.2156","learned":"de EXACTLY baseline (0.2466, 4 decimals); dir/variogram nudge +0.002/+0.001, rest noise. Capped large-shift genes carry ZERO proxy-DE signal — DE is driven by small-shift genes within 2SE. Answers the question outright: large noisy shifts are not the DE-loss source (there is no DE loss vs baseline to explain; this lane == baseline on primary)","next":"DO NOT scan K (no-op axis, would be proxy-tuning). Move to composition-only extrap (never tried on extrap, mirrors interp wins): predict E10.5 shares via log-linear trend, resample baseline rows, expression untouched"}}
{"iter":4,"kind":"experiment","generator":".auto/generate_componly.py","method":"comp_only_loglinear_t10.5_seed20261002","verdict":"keep","confirmation":"pending_seed_check","primary":{"name":"de_score","value":0.274,"direction":"higher"},"delta_vs_baseline":{"d_de_score":0.0274},"metrics":{"de_score":0.274,"de_direction":0.481,"neighborhood_mmd":0.17857,"morans_I_agreement":0.7775,"variogram":0.084202,"mmd_u":0.09875,"energy_distance":3.62067,"pseudobulk_pearson":0.7938,"variance_ratio":1.228,"occupancy_dice":0.823,"d2_shape":0.02447,"sliced_wasserstein":0.04491,"scale_log_ratio":0.2587,"count_log_ratio":0.7342,"library_size_ratio":1.482,"pb_rel_err":0.5526,"wall_s":14.0},"asi":{"mechanism":"E10.5 shares via log-linear trend (5 states trended, 17 fallback to baseline shares); baseline rows resampled, expression byte-identical","learned":"FIRST primary win: de +0.0274, dir +0.059, nmmd -0.027, variogram +0.010, mmd_u -0.006. Costs: morans -0.027, energy +0.13, library_ratio 1.482 (resample shifts library profile — expected, not a bug). Extrap DE is NOT expression-locked: composition channel moves it","caveat":"single resample seed — gain could be seed-specific row luck. MUST confirm with second seed before persisting/claiming. anndata dup-names warning is harmless (obs_names overwritten with deduped final right after slice)","next":"iter5: identical machinery, seed 20261003. Confirm bar: de clearly above 0.2466 again. If confirmed -> persist best to artifacts/autoresearch/; if not -> downgrade iter4 to seed luck, close comp-only as seed-fragile"}}
{"iter":5,"kind":"experiment","generator":".auto/generate_componly_s2.py","method":"comp_only_loglinear_t10.5_seed20261003","verdict":"discard","downgrades_iter4":true,"primary":{"name":"de_score","value":0.2466,"direction":"higher"},"delta_vs_baseline":{"d_de_score":0.0},"metrics":{"de_score":0.2466,"de_direction":0.4847,"neighborhood_mmd":0.17438,"morans_I_agreement":0.7789,"variogram":0.083095,"mmd_u":0.09971,"energy_distance":3.58174,"pseudobulk_pearson":0.7955,"variance_ratio":1.226,"occupancy_dice":0.8337,"d2_shape":0.02465,"sliced_wasserstein":0.04369,"scale_log_ratio":0.2599,"count_log_ratio":0.7342,"library_size_ratio":1.481,"pb_rel_err":0.5503,"wall_s":14.0},"asi":{"mechanism":"IDENTICAL to iter4 except resample seed ...002->...003 (same per-state counts, different rows)","learned":"de 0.274 -> 0.2466 (delta 0.0274 from ROW IDENTITY alone). iter4 win was SEED LUCK, not mechanism — DOWNGRADED to discard. Proxy-DE noise floor on resampling designs is ~+-0.03: enormous. Rule from here on: any resampling design must report median of 3 seeds before keep (generator-level replication, scorer itself is deterministic). Positive residue: dir (+0.059/+0.063) and nmmd (-0.027/-0.031) improved under BOTH seeds — composition shift robustly helps direction/geometry even while DE is seed-fragile. If a future frozen design ever targets dir/nmmd, comp-only is the lever; for DE-primary it is closed as seed-fragile","next":"deterministic expression-shift designs only (no resampling seed => no row-luck variance): iter6 = baseline delta x t-shrink C=1 float64 (fills the gap: x_r2 did float32 C=1, server REJECT 50.03, local value unknown)"}}
{"iter":6,"kind":"experiment","generator":".auto/generate_shrinkc1.py","method":"baseline_delta_shrinkC1.0_f64","verdict":"discard","primary":{"name":"de_score","value":0.2466,"direction":"higher"},"delta_vs_baseline":{"d_de_score":0.0},"metrics":{"de_score":0.2466,"de_direction":0.4354,"neighborhood_mmd":0.20838,"morans_I_agreement":0.8032,"variogram":0.078477,"mmd_u":0.10682,"energy_distance":3.7236,"pseudobulk_pearson":0.7736,"variance_ratio":1.288,"occupancy_dice":0.8207,"d2_shape":0.0153,"sliced_wasserstein":0.04086,"scale_log_ratio":0.2155,"count_log_ratio":0.7342,"library_size_ratio":1.0,"pb_rel_err":0.5727,"wall_s":14.0},"asi":{"mechanism":"baseline d x per-gene t-shrink C=1.0 float64 (mean_w=0.695, clip 0.2162); approximates goal x_r2 (float32 C=1, server 50.03 REJECT) whose local was never recorded","learned":"de EXACTLY baseline again (deterministic, no luck involved). dir +0.013 / variogram +0.004 up, but nmmd +0.003 / energy +0.23 / pb worse. Shrink family locally pinned: v0011-C2 (0.2466), x_r2-C1-f32 (server REJECT), this C1-f64 (0.2466) — local never moves, server went +0.11 then -0.50. Third inversion datapoint; C-scan refused (pinned axis, would be proxy-tuning)","next":"measure the missing endpoint: x_r1-lateref (alpha=0, server-high 50.74) LOCAL value via same blend machinery. alpha-trend predicts ~0.21 (local-worst <-> server-best). Either confirms inversion with 4 points or breaks the trend (interesting both ways)"}}
{"iter":7,"kind":"experiment","generator":".auto/generate_lateref0.py","method":"lateref_alpha0.0_same_machinery","verdict":"discard","primary":{"name":"de_score","value":0.2055,"direction":"higher"},"delta_vs_baseline":{"d_de_score":-0.0411},"metrics":{"de_score":0.2055,"de_direction":0.4319,"neighborhood_mmd":0.20951,"morans_I_agreement":0.8085,"variogram":0.078149,"mmd_u":0.1086,"energy_distance":3.78233,"pseudobulk_pearson":0.7683,"variance_ratio":1.294,"occupancy_dice":0.8207,"d2_shape":0.0153,"sliced_wasserstein":0.04086,"scale_log_ratio":0.2155,"count_log_ratio":0.7342,"library_size_ratio":1.0,"pb_rel_err":0.5788,"wall_s":13.0},"asi":{"mechanism":"alpha=0 endpoint of the frozen blend axis (pure mu95-mu825late shift, x_r1 mechanism; clip 0.2190)","learned":"HEADLINE: four deterministic points now complete — local 1.0:0.2466 > 0.5:0.2329 > 0.25:0.2192 > 0.0:0.2055 while server runs 50.53 -> ... -> 50.74 (highest). STRICTLY MONOTONIC INVERSION on the late-anchor axis: local proxy is a decreasing function of what the server rewards. Optimizing local DE along expression-shift magnitude = optimizing AWAY from server gains. dir stays ~0.43 throughout (robust); DE/magnitude is the inverted channel. This reframes the whole loop: deterministic expression shifts cannot win local DE (all pinned at 0.2466 except anchor-penalized ones); only row-identity moves it (+-0.03 luck). Remaining live axes: (1) data-frozen per-state adaptive shrinkage (deterministic), (2) x_o2-analog 3-seed median (only resampling test with local-best+server-TIE prior)","next":"iter8 = per-state adaptive shrinkage: per-gene t-shrink C=1 x state factor n95/(n95+n0), n0 = median n95 over shared states (data-frozen, single shot, no scan)"}}
{"iter":8,"kind":"experiment","generator":".auto/generate_adaptshrink.py","method":"adaptive_shrink_C1_x_statefrac_n0median","verdict":"discard","primary":{"name":"de_score","value":0.2466,"direction":"higher"},"delta_vs_baseline":{"d_de_score":0.0},"metrics":{"de_score":0.2466,"de_direction":0.4362,"neighborhood_mmd":0.20787,"morans_I_agreement":0.8052,"variogram":0.076833,"mmd_u":0.1063,"energy_distance":3.6243,"pseudobulk_pearson":0.7815,"variance_ratio":1.255,"occupancy_dice":0.8207,"d2_shape":0.0153,"sliced_wasserstein":0.04086,"scale_log_ratio":0.2155,"count_log_ratio":0.7342,"library_size_ratio":1.0,"pb_rel_err":0.5633,"wall_s":13.0},"asi":{"mechanism":"per-gene t-shrink C=1 x state factor n95/(n95+n0), n0=2601.0 (median n95, data-frozen); fstates NCC:0.50 Peri:0.65 V-CM:0.70 aPHM:0.41 pPHM:0.43","learned":"de EXACTLY 0.2466 — FOURTH deterministic pin (baseline/capK2/shrinkC1/adapt). Proxy-DE is a CONSTANT under deterministic expression shifts; adaptivity adds nothing. dir +0.014 / variogram +0.003 up, nmmd/energy/pb worse — same signature as every shrink variant. Per-state axis CLOSED (single principled shot; scanning n0/C = proxy-tuning on pinned readout)","next":"LAST DE-primary shot: x_o2-analog 3-seed median (sole design in history with local-best 0.2603 + server-TIE 50.52). If median <= baseline -> close DE-primary loop with terminal summary (inversion + noise floor are the deliverables, worth more than a 0.001 win)"}}
{"iter":9,"kind":"experiment","generator":".auto/generate_xo2median.py","method":"xo2_analog_3seed_median","verdict":"discard","bar_honored":"min3_gt_baseline","primary":{"name":"de_median","value":0.2603,"direction":"higher"},"delta_vs_baseline":{"d_de_median":0.0137},"metrics":{"de_seed20260929":0.2603,"de_seed20261004":0.2603,"de_seed20261005":0.2329,"de_median":0.2603,"de_min":0.2329},"asi":{"mechanism":"faithful x_o2 rebuild (v0011-C2-f32 expression asserted EXACT vs scored parent + compmix max_fold2.0) at design seed + 2 new seeds","learned":"design seed reproduces 0.2603 EXACTLY (harness valid); ...004 also 0.2603, ...005 drops to 0.2329. Bimodal row-luck again (+-0.03 band): 2/3 high, 1/3 low. Pre-committed bar (min3>baseline) FAILS -> DISCARD, no bar-moving. x_o2's historical local-best was partly seed luck too (though 2/3 high mode suggests a real but fragile effect — NOT robust enough to keep). DE-primary now has ZERO live axes: deterministic pinned (4x), anchor inverted, all resampling seed-fragile (2 families). Loop recommendation: CLOSE DE-primary; deliverables are the inversion map + luck-band quantification + closed-axes ledger","next":"terminal summary + ask user: close loop, or pivot primary (user decision only — changing metric mid-loop would be goalpost-moving)"}}
{"phase": "B_reinit", "kind": "session_header", "primary": {"name": "variogram", "value_baseline": 0.074261, "direction": "higher"}, "guardrails": {"de_score_min": 0.22, "neighborhood_mmd_max": 0.22, "energy_distance_max": 4.0}, "keep_bar": "resampling: min3_vario>0.074261 AND median_vario>0.078 AND guardrails all seeds; deterministic: vario>0.078 + guardrails; noise_floor_vario=0.002", "justification": "server registry: variogram weakest extrap skill (28-33) and v0008/v0010 variogram losses; chosen pre-runs, external to loop", "harking_ack": "comp Route-A variogram gains are confirmatory not selective; de-primary verdicts stand, no retroactive re-grading"}
{"iter":10,"kind":"experiment","phase":"B","generator":".auto/generate_componly_s3.py","method":"comp_only_loglinear_t10.5_seed20261006","verdict":"keep","persisted":"artifacts/autoresearch/t2-extrap-20261001-v1/submission.median-seed06.h5ad","primary":{"name":"variogram","value":0.083151,"direction":"higher"},"delta_vs_baseline":{"d_variogram":0.00889},"three_seed_set":{"20261002":0.084202,"20261003":0.083095,"20261006":0.083151},"median_variogram":0.083151,"min_variogram":0.083095,"guardrails":"pass_all_3_seeds","metrics":{"de_score":0.274,"de_direction":0.4852,"neighborhood_mmd":0.17354,"morans_I_agreement":0.7779,"variogram":0.083151,"mmd_u":0.09666,"energy_distance":3.54555,"pseudobulk_pearson":0.7959,"variance_ratio":1.228,"occupancy_dice":0.8284,"d2_shape":0.02485,"sliced_wasserstein":0.04409,"scale_log_ratio":0.2595,"count_log_ratio":0.7342,"library_size_ratio":1.481,"pb_rel_err":0.5501,"wall_s":13.0},"asi":{"mechanism":"same frozen log-linear comp machinery, 3rd seed; completes the median set","learned":"FIRST STANDING KEEP: median 0.083151 (>0.078 bar), min 0.083095 (>baseline), guardrails pass all 3. KEY CONTRAST: variogram seed-band is +-0.0006 (tight) while DE on the SAME candidates spans +-0.03 (bimodal luck) — variogram is the better-behaved optimization target, DE the noisy one. Persisted the MEDIAN seed, not the max (anti-luck showcasing). dir 0.4852 / nmmd 0.17354 / mmd_u 0.09666 all best-yet; costs morans -0.027 (all comp runs) + library 1.481 (expected resample signature)","next":"iter11 = x_o2-analog FULL metrics 3-seed median under Route B bar: does shrink-expression add variogram over comp-only? (iter9 only recorded de/dir/nmmd — variogram unrecorded, must rebuild)"}}
{"iter":11,"kind":"experiment","phase":"B","generator":".auto/generate_xo2median.py","method":"xo2_analog_fullmetrics_3seed_median","verdict":"discard","primary":{"name":"variogram_median","value":0.074481,"direction":"higher"},"delta_vs_baseline":{"d_vario_median":0.00022},"three_seed_vario":{"20260929":0.074691,"20261004":0.074481,"20261005":0.073566},"guardrails":"pass_all_3_seeds","metrics_per_seed":{"20260929":{"de":0.2603,"dir":0.4376,"nmmd":0.1997,"vario":0.074691,"mmd_u":0.09931,"energy":3.55382},"20261004":{"de":0.2603,"dir":0.4408,"nmmd":0.19978,"vario":0.074481,"mmd_u":0.09823,"energy":3.53952},"20261005":{"de":0.2329,"dir":0.4347,"nmmd":0.19813,"vario":0.073566,"mmd_u":0.09744,"energy":3.48145}},"asi":{"mechanism":"same faithful x_o2 rebuild as iter9 (v0011-exact + compmix), full metrics this time (iter9 only kept de/dir/nmmd)","learned":"DISCARD under Route B bar (median 0.074481 < 0.078; min 0.073566 < baseline). HEADLINE-2: shrink-expression ERASES the comp variogram gain — same resampled rows score 0.083 with baseline expression but 0.0745 with shrunk expression. Mechanism: variogram rewards preserved state separation; shrinkage damps it away. This mirrors the server/local split once more (server rewards shrinkage v0011/x_r1; local variogram rewards separation). Shrink-expression axis now CLOSED under BOTH primaries (DE pinned+inverted, variogram erased). de bimodality reproduced exactly (deterministic machinery confirmed twice)","next":"Route B live set: comp-only keep stands alone; no disciplined follow-up remains (trend-form scan refused, damp/amplify server-rejected, negative control valueless). Recommend pausing loop; propose comp-only for a future frozen lane ONLY if user wants a dir/nmmd/vario (non-DE) design"}}
{"kind":"packaging","phase":"B","candidate":"v0024_arcomp","member":"t2_hrt_ext__arcomp__v0024.h5ad","sha256":"7cbe915e633069723200efa03b11c1dd960d177fee897e971abe633ec6b341e2","zip":"deliveries/t2arex__t2__upload__20261001.zip","zip_status":"READY_NOT_REGISTERED","contract":"fail_by_design_accepted_4_mass_exemptions_zero_other","index_row":"NOT_created_pending_coordinator","recommendation":"lane_agent_AGAINST_upload","recommendation_reasons":["cousin_x_n3_server_50.38_REJECT","proxy_adversarial_inverted_board","no_server_mapping_for_local_vario","de_bimodal_luck_single_score_variance"],"handoff":"artifacts/autoresearch/t2-extrap-20261001-v1/HANDOFF.md"}
{"kind":"correction","phase":"B_to_C","date":"2026-10-01","what":"ROUTE B VARIogram DIRECTION WAS INVERTED","source_check":"third_party/veckit/common/core_metrics.py:326 docstring 'Lower is better; 0 for a perfect match'","impact":"iter10 comp-only 'KEEP' is REVERSED: its variogram 0.083151 vs baseline 0.074261 is a DEGRADATION (+12% worse) under the true direction, not a gain. iter11 conclusion also flips: shrink-expression moves variogram BACK TOWARD baseline (x_o2 0.0736-0.0747 vs comp 0.0832), i.e. shrink was the better channel, not the worse. Route B standing keep is WITHDRAWN as an optimization result (the artifact stays on disk as a research record, never as a claimed improvement).","corroboration":"server-side: comp cousin x_n3 portal vario skill 47.4 < shrink v0011 48.5, same ordering as corrected local values (x_n3 0.0753 worse than baseline 0.0743)","process_lesson":"directions must be read from the scorer source docstrings, never inferred from portal ordering or from 'bigger number looks better'","cause":"I asserted the direction in the Route B header without opening core_metrics.py"}
{"kind":"correction_scan","date":"2026-10-01","method":"grepped every metric docstring in core_metrics.py / shape_metrics.py / T2/metrics.py","verified_directions":{"de_score":"higher","de_direction":"higher","energy_distance":"lower","mmd_u":"lower","variogram":"LOWER (was wrong)","d2_shape":"lower","sliced_wasserstein":"lower","occupancy_dice":"higher","scale_log_ratio":"signed, 0 ideal -> abs lower","count_log_ratio":"signed, 0 ideal","neighborhood_mmd":"lower","morans_I_agreement":"higher (constraint)","pseudobulk_pearson":"higher (constraint)","pb_rel_err":"lower","variance_ratio":"ideal 1","library_size_ratio":"ideal 1"},"note":"all previous routes used only de/dir/nmmd/energy/vario as informal gates; only vario's sign was wrong in my headers. Round2/g0 lanes predate this session and are untouched."}
