{"phase": "T1", "kind": "packaged_draft", "date": "2026-10-03", "run_id": "AR-T1-MIX2-20261003-v1", "group": "AR-T1-MIX2-20261003", "staged_members": [{"member": "t1_val__mix3538even__v0052.h5ad", "lane": "P1", "sha256": "7a6be221bee7af5c8b98591227dbcc971feb14e0d2e506ec887c59a9b9e7015b", "construction": "50/50 v0035-final x v0038-final stratified whole-row mix, seed 20260921", "contract": "PASS", "role": "requested cheap lane (M5 analogue; report 3-seed median de +1q, vario 0.000396 < baseline)"}, {"member": "t1_val__mix3538evenb__v0053.h5ad", "lane": "P2", "sha256": "7f8552b056011cd56b07175db5eb0742ba92a889e215d9015646a77d9d527d02", "construction": "same as P1, seed 20261023 (batch-convention second draw, NOT seed-mined)", "contract": "PASS", "role": "seed-pair partner: server row-luck readout (previous batch same-design spread was 53.72 vs 53.32)"}, {"member": "t1_val__mix3638even__v0054.h5ad", "lane": "P3", "sha256": "7ea3e891462b62bdd5a349d19818444ff8834b56a5a63a228cd70943cebaaebd", "construction": "50/50 v0036-final x v0038-final, seed 20260921", "contract": "PASS", "role": "variant of the server-best pair 36x38 (v0051 70/30 = 53.92 = current T1 best); more cov-OT donor"}, {"member": "t1_val__mix3way__v0055.h5ad", "lane": "P4", "sha256": "0878a1d71e9125035caffa842a158b926485107c4fa1d71f0db78cea85521e6c", "construction": "equal-thirds v0035/36/38 stratified whole-row mix (s2mix recipe extended to 3 pools), seed 20260921", "contract": "PASS", "role": "three-pool mechanism (M4 analogue; report median pin, best seed +1q; new pool combination)"}, {"member": "t1_val__mix3538f030__v0056.h5ad", "lane": "P5", "sha256": "646dc8204c3d4617fe388698c91b906397a14c1f339667032b08e2b4a927e13c", "construction": "30/70 v0035-final x v0038-final, seed 20260921", "contract": "PASS", "role": "weight extreme (M6 analogue; best report mmd of the +1q points, 0.00926; median pin across seeds)"}], "contract": "5/5 PASS (frozen contract_io + P0-LOCK; contract parent v0035 for all lanes; donor shas re-verified vs INDEX; 300-row sampled donor-verbatim audit per lane)", "zip": "deliveries/art1mix2__t1__upload__20261003.zip", "zip_sha256": "e8b60cd8d87172db93206d03b2f6f86feb169846ec59f34987e54041a40b6474", "zip_bytes": 356967712, "receipt": "deliveries/art1mix2__t1__upload__20261003.zip.receipt.json", "staged": "artifacts/autoresearch/t1-20261003-v1/stage_art1mix2/ (MANIFEST/UPLOAD_MANIFEST/RUN_ID_MAP/EVIDENCE_MANIFEST_POINTERS/HANDOFF/README)", "versions": "v0052-v0056 PROPOSED only (INDEX last registered T1:val version = v0047; v0048-v0051 informally used by D2R3 and the 2026-10-02 AR-T1-MIX batch whose scores are logged but whose INDEX rows are still pending coordinator) \u2014 coordinator allocates; rename members if numbers differ (identity = sha256)", "recommended_upload_order": ["v0054 (mix3638even)", "v0052 (mix3538even)", "v0055 (mix3way)", "v0053 (mix3538evenb)", "v0056 (mix3538f030)"], "index_registry_coordination": "NOT touched (coordinator scope); no E10.5 truth; target_used=false", "confidence_basis": "server evidence: 36x38@70/30=53.92 (best), 35x38@70/30=53.72; mixes beat their parents by +0.4..+0.6. NOT claimed to beat 53.92 \u2014 local proxy does not rank champions; server alone arbitrates. Seed-pair included because previous batch showed server row-luck d0.40."}
{"phase": "T1", "kind": "score_return", "date": "2026-10-03", "run_id": "AR-T1-MIX2-20261003-v1", "returns": {"v0052_mix3538even": {"board": 53.67, "de": 46.9, "dir": 60.0, "mmd": 56.1, "vario": 50.5, "verdict": "scored backup (-0.25 vs v0051)"}, "v0053_mix3538evenb": {"board": 53.36, "de": 46.7, "dir": 59.9, "mmd": 55.4, "vario": 50.4, "verdict": "REJECT (-0.56; below both parents)"}, "v0054_mix3638even": {"board": 53.98, "de": 47.0, "dir": 60.4, "mmd": 56.5, "vario": 51.0, "verdict": "TIE (+0.06 vs v0051 53.92, \u00b10.1 band; no promotion; tied numeric-high backup)"}, "v0055_mix3way": {"board": 53.48, "de": 46.4, "dir": 59.4, "mmd": 56.3, "vario": 50.7, "verdict": "scored backup marginal (-0.44; beats v0035/v0036 parents)"}, "v0056_mix3538f030": {"board": 53.76, "de": 46.9, "dir": 60.3, "mmd": 56.1, "vario": 50.6, "verdict": "scored backup (-0.16; beats both parents)"}}, "incumbent": "v0051 = 53.92 stays (v0054 +0.06 inside \u00b10.1 TIE band, tie to incumbent)", "derived_total": "160.44 unchanged (v0054 would give 160.50; portal Total still 156.06)", "headlines": ["seed lottery 3rd replication: same-design v0052 vs v0053 d0.31 (batch1 d0.40); T1 mix row-luck \u00b10.3-0.4 > TIE band -> ship 2 seeds or deterministic", "controlled pair comparison (same weight+seed): 36x38 53.98 vs 35x38 53.67 = +0.31; 36-family leads 3rd time", "35x38 weight axis dead: f0.3/0.5/0.7 all within row-luck", "three-pool = dilution (53.48 below both pair components 53.67/53.98); axis closed", "mix family saturated: 8 scored lanes in 53.32-53.98, mean ~53.7; next real move needs a NEW mechanism family"], "registered": ["reports/SERVER_SCORE_REGISTRY.md#t1-ar-mix2-score-return-20261003", "reports/SERVER_SUBMETRIC_REGISTRY.tsv +20 rows", "reports/LANE_VERDICTS.tsv +5 rows", "docs/coordination/DECISIONS.md D-20261003-T1MIX2SCORE-001", "DECISIONS.md index line", "AUDIT.md regenerated (164 lanes)"], "pending_coordinator": ["INDEX rows v0052-v0056 + canonical placement", "T1_TRACKING line", "STATUS/TODO sync", "BACKLOG from 2026-10-02 still owed: INDEX rows v0049-v0051 + their submetric rows + LANE_VERDICTS rows"], "note": "v0052 number was referenced (as not-built) by closed T1-EXTPRE; no artifact conflict, identity by SHA256", "blocks_submission": false}
